{
  "boundary": "first-snes-end-frame",
  "capture": {
    "event_count": 25087,
    "sa1_events": 16554,
    "scpu_events": 8533
  },
  "failure_policy": "generated-dispatch-stops-on-first-unsupported-or-unobserved-identity",
  "generated_nodes": 254,
  "processors": {
    "sa1": {
      "first_unsupported": null,
      "new_nodes": 17,
      "reachable_nodes": 40,
      "unresolved_nodes": 0,
      "unsupported_opcodes": []
    },
    "scpu": {
      "first_unsupported": null,
      "new_nodes": 54,
      "reachable_nodes": 214,
      "unresolved_nodes": 0,
      "unsupported_opcodes": []
    }
  },
  "schema_version": 1,
  "unresolved": {
    "sa1": [],
    "scpu": []
  }
}
